{"build_policy":{"claims":"frozen_bottom_up_claim_ledger","gene_nodes":"canonicalized_from_finding_comparators","ledger_properties":"copied_unchanged","model_calls":false,"network":false,"relationships":false,"semantic_extraction":false},"node_counts":{"Claim":555,"Evidence":45640,"Finding":8718,"Gene":309,"Reference":13974,"TargetGene":1773},"output":{"bytes":63234178,"path":"nodes.jsonl","records":70969,"sha256":"377db4a550f037fa4ad07eeadbffe3c4877b61923112b4947340bb8842b2d82b"},"schema_version":"distributed_agents-biokg-node-build-v2","sources":{"claims":{"path":"artifacts/claims/claims.jsonl","records":555,"sha256":"9b6a6be7be195815259918d77fa0eb2361f0bf8806490f4e68cd7388862270bd","targets":1286},"evidence":{"path":"artifacts/ledgers/evidence.jsonl","records":45640,"sha256":"cb471eb1fc2f98c75c78006e319877f02d01cb877341bc4e77008a86c66f39d6","targets":1773},"findings":{"path":"artifacts/ledgers/findings.jsonl","records":8718,"sha256":"b1f9dc74ceb3a95cf41b14977abbc82c2d110303eca701b90ab2ae5da251acef","targets":1772},"references":{"path":"artifacts/ledgers/references.jsonl","records":13974,"sha256":"ca383015fc09a8e1fd55ab1e576a1950cc025814be32f0d85ecc8237d8e49e2e","targets":1773},"reports":{"path":"artifacts/reports/reports.jsonl","records":1773,"sha256":"0d4e926be8a066952c0e1857b9fab5ec70396093b4f8bb41de1a5dc7768a487f","targets":1773}}}
